{
  "konu": "Siparis Teklifiniz — Tasiyici Profil (Termin Bilgilendirmesi)",
  "mail_govde_md": "Sayin Mehmet Celik,\n\nSiparislerinizi aldik, tesekkur ederiz.\n\n30 adet Tasiyici Profil icin fiyat teklifimiz 2.100,00 USD'dir. Mevcut kapasitemiz nedeniyle tahmini teslim suresi 15 is gunu olarak ongorumlektedir.\n\nBu durum dogrultusunda herhangi bir oncelik talebiniz veya sorunuz varsa lutfen bize bildirin.\n\nSaygilarimizla,\nMusteri Iliskileri Ekibi",
  "kullanilan_kaynaklar": ["teklif#ozet"],
  "topraklama_uyarisi": false
}
