{
  "konu": "Siparis Teklifiniz — Flans Kapagi",
  "mail_govde_md": "Sayin Ahmet Yilmaz,\n\nSiparislerinizi aldik ve degerlendirildi, tesekkur ederiz.\n\nTalebiniz dogrultusunda 12 adet Flans Kapagi icin fiyat teklifimiz 980,00 USD olup tahmini teslim suresi 5 is gunudur.\n\nHerhangi bir sorunuz veya onayiniz icin lutfen bizimle iletisime gecmekten cekinmeyiniz.\n\nSaygilarimizla,\nMüsteri Iliskileri Ekibi",
  "kullanilan_kaynaklar": ["teklif#ozet"],
  "topraklama_uyarisi": false
}
