{
  "konu": "Siparis Teklifiniz — Motor Braketi ve Vida Takozu",
  "mail_govde_md": "Sayin Zeynep Kaya,\n\nCok parcali siparislerinizi aldik, ilginiz icin tesekkur ederiz.\n\nTalebiniz dogrultusunda asagidaki urunler icin teklifimizi paylasiyoruz:\n- Motor Braketi: 50 adet\n- Vida Takozu: 200 adet\n\nToplam fiyat teklifimiz 4.750,00 USD olup tahmini teslim suresi 10 is gunudur.\n\nOnayinizi veya varsa sorularinizi bekliyoruz.\n\nSaygilarimizla,\nMusteri Iliskileri Ekibi",
  "kullanilan_kaynaklar": ["teklif#ozet"],
  "topraklama_uyarisi": false
}
